id,judul_kkn,waktu_pelaksanaan,url_pemberitaan,laporan_akhir_kkn,url_video_aktivitas_kkn,url_laporan_akhir,periodesem,nama_kelurahan_desa,desa_text,nama_kecamatan,nama_kota_kabupaten,nama_provinsi,latitude,longitude,lokasi
382,PENGOLAHAN SERAT DAUN NANAS MENJADI MATERIAL KOMPOSIT DI KABUPATEN KEDIRI,2021-11-22,https://www.its.ac.id/news/2022/01/26/its-sosialisasikan-pengolahan-daun-nanas-menjadi-material-komposit/,07cebc5870c6eaf3b68cbd9f648f496f,https://www.youtube.com/watch?v=MLCmWw7y9Z0,https://data.its.ac.id/file_server_its/kkn_download.php?object_id=07cebc5870c6eaf3b68cbd9f648f496f,20211,SATAK,Satak,PUNCU,KABUPATEN KEDIRI,JAWA TIMUR,-7.891851,112.2289769,"Satak SATAK, KECAMATAN PUNCU, KABUPATEN KEDIRI, PROVINSI JAWA TIMUR"
451,TEKNOLOGI PEMBUATAN BENANG SERAT DAUN NANAS UNTUK BAHAN BAKU INDUSTRI KERAJINAN KREATIF GUNA MENINGKATKAN KESEJAHTERAAN MASYARAKAT DESA SATAK KABUPATEN KEDIRI,2021-12-24,https://radarkediri.jawapos.com/showcase/17/10/2022/52127/,9645c0f6e3e3493ac58ddf0d62ef531c,https://www.youtube.com/watch?v=CMJ46uf5WK0,https://data.its.ac.id/file_server_its/kkn_download.php?object_id=9645c0f6e3e3493ac58ddf0d62ef531c,20211,SATAK,Satak,PUNCU,KABUPATEN KEDIRI,JAWA TIMUR,-7.8918292,112.1239101,"Satak SATAK, KECAMATAN PUNCU, KABUPATEN KEDIRI, PROVINSI JAWA TIMUR"
36,KKN Daring di Tengah Wabah COVID19: Desa Satak,2020-06-08,,,,,20192,SATAK,,PUNCU,KABUPATEN KEDIRI,JAWA TIMUR,-7.891851,112.2289768," SATAK, KECAMATAN PUNCU, KABUPATEN KEDIRI, PROVINSI JAWA TIMUR"
37,KKN Daring di Tengah Wabah COVID19: Desa Asmorobangun,2020-06-08,,,,,20192,ASMOROBANGUN,,PUNCU,KABUPATEN KEDIRI,JAWA TIMUR,-7.8402276,112.2397853," ASMOROBANGUN, KECAMATAN PUNCU, KABUPATEN KEDIRI, PROVINSI JAWA TIMUR"
27,Pengembangan Ekonomi Warga Desa Wonorejo Berdasarkan Hasil Pertanian dan Mempromosikan Produk Usaha Desa dengan Sistem Online,2020-01-05,https://www.its.ac.id/news/2020/06/02/terus-berkarya-its-jalani-kkn-daring-di-tengah-wabah-covid-19/,2ee41b47b65160470a6e48cd75b1f46d,https://youtu.be/8T9rdGypfZA,https://data.its.ac.id/file_server_its/kkn_download.php?object_id=2ee41b47b65160470a6e48cd75b1f46d,20192,WONOREJO,,PUNCU,KABUPATEN KEDIRI,JAWA TIMUR,-7.8618769,111.9917603," WONOREJO, KECAMATAN PUNCU, KABUPATEN KEDIRI, PROVINSI JAWA TIMUR"
28,"PENYULUHAN COVID-19, PENCERDASAN USAHA KECIL MENENGAH DAN AGROWISATA JAMUR UNTUK MEMBANTU KESEHATAN DAN KESEJAHTERAAN PENDUDUK",2020-06-14,https://www.its.ac.id/news/2020/06/03/mahasiswa-its-bantu-tingkatkan-industri-jamur-lewat-kkn-daring/,f0048bc8c676c66050a2579fcc15a3c5,https://youtu.be/wCSazfBV2Fg,https://data.its.ac.id/file_server_its/kkn_download.php?object_id=f0048bc8c676c66050a2579fcc15a3c5,20192,MANGGIS,,PUNCU,KABUPATEN KEDIRI,JAWA TIMUR,-7.9588206,112.1693403," MANGGIS, KECAMATAN PUNCU, KABUPATEN KEDIRI, PROVINSI JAWA TIMUR"
29,PENGEMBANGAN POTENSI EKONOMI MASYARAKAT DESA SIDOMULYO DENGAN MEMBANTU MEMPERKENALKAN PRODUK HASIL OLAHAN PADA WEBSITE,2020-05-26,https://www.its.ac.id/news/en/2020/06/15/empowering-the-economy-75-its-students-launch-village-websites/,3b0dd49831cac5bfff4d22d592e57dc2,https://www.youtube.com/watch?v=5ZW-AbFaqXQ&amp;feature=youtu.be,https://data.its.ac.id/file_server_its/kkn_download.php?object_id=3b0dd49831cac5bfff4d22d592e57dc2,20192,SIDOMULYO,,PUNCU,KABUPATEN KEDIRI,JAWA TIMUR,-7.823273,112.1794648," SIDOMULYO, KECAMATAN PUNCU, KABUPATEN KEDIRI, PROVINSI JAWA TIMUR"
35,KKN Daring di Tengah Wabah COVID19: Desa Watugede,2020-06-08,,,https://youtu.be/_4VijOwhlX4,,20192,WATUGEDE,,PUNCU,KABUPATEN KEDIRI,JAWA TIMUR,-7.8072899,112.1723232," WATUGEDE, KECAMATAN PUNCU, KABUPATEN KEDIRI, PROVINSI JAWA TIMUR"
101,KKNT RECON KEMDIKBUD: ADAPTASI PENDAMPINGAN KEGIATAN PEMBELAJARAN LITERASI DAN NUMERASI  DI SDN GADUNGAN 5 DALAM MASA PANDEMI,2020-08-18,https://www.its.ac.id/news/2020/10/19/mahasiswa-its-bantu-kegiatan-belajar-mengajar-di-kabupaten-kediri/,e6f551385dafbe8f6a777bc4954d00c3,https://youtu.be/1Nw7AxZk7ck,https://data.its.ac.id/file_server_its/kkn_download.php?object_id=e6f551385dafbe8f6a777bc4954d00c3,20201,GADUNGAN,,PUNCU,KABUPATEN KEDIRI,JAWA TIMUR,-7.8055266,112.1748452," GADUNGAN, KECAMATAN PUNCU, KABUPATEN KEDIRI, PROVINSI JAWA TIMUR"
38,KKN Daring di Tengah Wabah COVID19: Desa Gadungan,2020-06-08,,,https://www.youtube.com/watch?v=CcaIXXi-Ff4,,20192,GADUNGAN,,PUNCU,KABUPATEN KEDIRI,JAWA TIMUR,-7.8055266,112.1748452," GADUNGAN, KECAMATAN PUNCU, KABUPATEN KEDIRI, PROVINSI JAWA TIMUR"
96,KKNT RECON KEMDIKBUD: KKNT Literasi dan Numerasi Luring  SDN GEDANGSEWU 1,2020-08-22,https://www.its.ac.id/news/2020/10/19/mahasiswa-its-bantu-kegiatan-belajar-mengajar-di-kabupaten-kediri/,2260ce71ccd2521f5aada1a70858dfc2,https://youtu.be/1Nw7AxZk7ck,https://data.its.ac.id/file_server_its/kkn_download.php?object_id=2260ce71ccd2521f5aada1a70858dfc2,20201,GEDANGSEWU,,PARE,KABUPATEN KEDIRI,JAWA TIMUR,-7.7869276,112.1651458," GEDANGSEWU, KECAMATAN PARE, KABUPATEN KEDIRI, PROVINSI JAWA TIMUR"
98,KKNT RECON KEMDIKBUD: PENDAMPINGAN PROSES BELAJAR MENGAJAR DI SDN BENDO  2,2020-08-18,https://www.its.ac.id/news/2020/10/19/mahasiswa-its-bantu-kegiatan-belajar-mengajar-di-kabupaten-kediri/,221ca2a110a80d6c1ce40114695bc722,https://youtu.be/1Nw7AxZk7ck,https://data.its.ac.id/file_server_its/kkn_download.php?object_id=221ca2a110a80d6c1ce40114695bc722,20201,GEDANGSEWU,,PARE,KABUPATEN KEDIRI,JAWA TIMUR,-7.7869276,112.1651458," GEDANGSEWU, KECAMATAN PARE, KABUPATEN KEDIRI, PROVINSI JAWA TIMUR"
94,"KKNT RECON KEMDIKBUD: KKNT LITERASI DAN NUMERASI LURING  PENDAMPINGAN PROSES BELAJAR MENGAJAR DAN  PENYELESAIAN SISTEM INFORMASI DI SDN GEDANGSEWU 3  DESA GEDANGSEWU, KECAMATANPARE, KABUPATENKEDIRI,  JAWA TIMUR",2020-08-18,https://www.its.ac.id/news/2020/10/19/mahasiswa-its-bantu-kegiatan-belajar-mengajar-di-kabupaten-kediri/,701a00e56b2ead46112e64b9a09b8358,https://youtu.be/1Nw7AxZk7ck,https://data.its.ac.id/file_server_its/kkn_download.php?object_id=701a00e56b2ead46112e64b9a09b8358,20201,GEDANGSEWU,,PARE,KABUPATEN KEDIRI,JAWA TIMUR,-7.7869276,112.1651458," GEDANGSEWU, KECAMATAN PARE, KABUPATEN KEDIRI, PROVINSI JAWA TIMUR"
91,KKNT RECON KEMDIKBUD: KKNT Literasi dan Numerasi Luring,2020-08-18,https://www.its.ac.id/news/2020/10/19/mahasiswa-its-bantu-kegiatan-belajar-mengajar-di-kabupaten-kediri/,1be1bfa0fce1706f1e92bee707831e6e,https://youtu.be/1Nw7AxZk7ck,https://data.its.ac.id/file_server_its/kkn_download.php?object_id=1be1bfa0fce1706f1e92bee707831e6e,20201,TULUNGREJO,,PARE,KABUPATEN KEDIRI,JAWA TIMUR,-7.7574556,112.1731004," TULUNGREJO, KECAMATAN PARE, KABUPATEN KEDIRI, PROVINSI JAWA TIMUR"
99,KKNT RECON KEMDIKBUD: PENDAMPINGAN PROSES BELAJAR MENGAJAR DI SDN TULUNGREJO 2,2020-08-18,https://www.its.ac.id/news/2020/10/19/mahasiswa-its-bantu-kegiatan-belajar-mengajar-di-kabupaten-kediri/,10d4514082e1282bb2c3d5b7eef7a7a7,https://youtu.be/1Nw7AxZk7ck,https://data.its.ac.id/file_server_its/kkn_download.php?object_id=10d4514082e1282bb2c3d5b7eef7a7a7,20201,TULUNGREJO,,PARE,KABUPATEN KEDIRI,JAWA TIMUR,-7.7574556,112.1731004," TULUNGREJO, KECAMATAN PARE, KABUPATEN KEDIRI, PROVINSI JAWA TIMUR"
97,KKNT RECON KEMDIKBUD: PENINGKATAN PEMAHAMAN KONSEP NUMERASI DI MASA PANDEMI,2020-08-24,https://www.its.ac.id/news/2020/10/19/mahasiswa-its-bantu-kegiatan-belajar-mengajar-di-kabupaten-kediri/,6b42b4a4a4a58f037676d9de6390f295,https://youtu.be/1Nw7AxZk7ck,https://data.its.ac.id/file_server_its/kkn_download.php?object_id=6b42b4a4a4a58f037676d9de6390f295,20201,TULUNGREJO,,PARE,KABUPATEN KEDIRI,JAWA TIMUR,-7.7574556,112.1731004," TULUNGREJO, KECAMATAN PARE, KABUPATEN KEDIRI, PROVINSI JAWA TIMUR"
100,KKNT RECON KEMDIKBUD: PENINGKATAN PEMAHAMAN SISWA TENTANG MATEMATIKA DAN MEMBANTU  ADMINISTRASI SDN PARE 4,2020-08-24,https://www.its.ac.id/news/2020/10/19/mahasiswa-its-bantu-kegiatan-belajar-mengajar-di-kabupaten-kediri/,4868b1ba084dbc9734fcaa0b50f3b0f2,https://youtu.be/1Nw7AxZk7ck,https://data.its.ac.id/file_server_its/kkn_download.php?object_id=4868b1ba084dbc9734fcaa0b50f3b0f2,20201,PARE,,PARE,KABUPATEN KEDIRI,JAWA TIMUR,-7.7655118,112.1891442," PARE, KECAMATAN PARE, KABUPATEN KEDIRI, PROVINSI JAWA TIMUR"
537,Kemitraan Pengembangan SDM Remaja untuk mendukung Program SDGs Budaya Desa Adaptif,2022-03-30,https://www.its.ac.id/news/2022/10/31/maksimalkan-potensi-pemuda-desa-abmas-itsgelar-pelatihan/,73ae1145c1f19acdc8c298c339f00aec,https://youtu.be/XHoRkQIR62w,https://data.its.ac.id/file_server_its/kkn_download.php?object_id=73ae1145c1f19acdc8c298c339f00aec,20212,BADAS,KRECEK,BADAS,KABUPATEN KEDIRI,JAWA TIMUR,"112.2254504,","112.2254504,","KRECEK BADAS, KECAMATAN BADAS, KABUPATEN KEDIRI, PROVINSI JAWA TIMUR"
455,Pengelolaan Sampah Berbasis Pemberdayaan Masyarakat di Wisata Gronjong Wariti,2022-06-18,https://www.its.ac.id/news/2022/07/28/abmas-its-giatkan-pengomposan-sampah-di-gronjong-wariti/,e4b60688ac93252bd4f0c58aaf15714c,https://youtu.be/jmq2TVklz0c,https://data.its.ac.id/file_server_its/kkn_download.php?object_id=e4b60688ac93252bd4f0c58aaf15714c,20212,MEJONO,Mejono,PLEMAHAN,KABUPATEN KEDIRI,JAWA TIMUR,-7.7270038,112.1320226,"Mejono MEJONO, KECAMATAN PLEMAHAN, KABUPATEN KEDIRI, PROVINSI JAWA TIMUR"
186,KKN ABMAS PERANCANGAN FASILITAS PENGEMASAN PRODUK TEMPE YANG DILENGKAPI DENGAN INSPEKSI KEMASAN,2020-06-20,https://www.its.ac.id/news/2021/02/06/its-tingkatkan-kualitas-ukm-tempe-dengan-mesin-terotomasi/,1d222f10df8da21f0890f6ecde993647,https://youtu.be/7OHS1zuBi-c,https://data.its.ac.id/file_server_its/kkn_download.php?object_id=1d222f10df8da21f0890f6ecde993647,20192,KWARON,,PAPAR,KABUPATEN KEDIRI,JAWA TIMUR,-7.7304614,112.0600456," KWARON, KECAMATAN PAPAR, KABUPATEN KEDIRI, PROVINSI JAWA TIMUR"
58,KKNT RECON KEMDIKBUD: PENINGKATKAN LITERASI DAN NUMERISASI SISWA SERTA PENDAMPINGAN  PEMBELAJARAN DIGITAL SEKOLAH DASAR DALAM MASA PANDEMI COVID-19,2020-08-18,https://www.its.ac.id/news/2020/09/29/mahasiswa-its-bantu-pembelajaran-digital-sd-di-kediri,f5ec321eda0c69f19adf879bdbcf61d7,https://youtu.be/Cmo7M8RHOsM,https://data.its.ac.id/file_server_its/kkn_download.php?object_id=f5ec321eda0c69f19adf879bdbcf61d7,20201,PUTIH,,GAMPENGREJO,KABUPATEN KEDIRI,JAWA TIMUR,-7.7809065,112.0121851," PUTIH, KECAMATAN GAMPENGREJO, KABUPATEN KEDIRI, PROVINSI JAWA TIMUR"
238,KKN ABMAS DESA REJOSARI MALANG SELATAN: INOVASI MESIN PENGERING MIE PORANG,2020-09-26,https://www.its.ac.id/news/2021/04/10/dorong-ukm-desa-kkn-its-rakit-mesin-pengering-mi/,3b30ce3e1fcdcd96004789881a69207a,https://youtu.be/_nL2m4Le3QM,https://data.its.ac.id/file_server_its/kkn_download.php?object_id=3b30ce3e1fcdcd96004789881a69207a,20201,REJOSARI,,BANTUR,KABUPATEN MALANG,JAWA TIMUR,-8.2756841,112.5787499," REJOSARI, KECAMATAN BANTUR, KABUPATEN MALANG, PROVINSI JAWA TIMUR"
245,KEGIATAN DAN TINDAKAN TANGGAP BENCANA PADA DESA WIROTAMAN DENGAN PEMANFAATAN POTENSI SUMBER MATA AIR UNTUK PERENCANAAN DISTRIBUSI JARINGAN AIR BERSIH PADA LOKASI KEJADIAN BENCANA DI MALANG SELATAN – JAWA TIMUR,2021-09-19,https://www.its.ac.id/news/2021/12/11/kkn-abmas-its-bangun-jaringan-air-bersih-di-desa-wirotaman/,c493e70470909783680d7741a0b92828,https://www.youtube.com/watch?v=iN9LmS_WDos,https://data.its.ac.id/file_server_its/kkn_download.php?object_id=c493e70470909783680d7741a0b92828,20211,WIROTAMAN,,AMPELGADING,KABUPATEN MALANG,JAWA TIMUR,-8.260447093441854,112.85646080749294," WIROTAMAN, KECAMATAN AMPELGADING, KABUPATEN MALANG, PROVINSI JAWA TIMUR"
341,"Pemetaaan Potensi Air Tanah Menggunakan Geolistrik di Daerah Pasca Gempa Desa Wirotaman, Kecamatan Ampelgading, Kabupaten Malang",2021-08-07,https://www.its.ac.id/news/2021/09/17/tim-kkn-abmas-its-bantu-desa-wirotaman-petakan-lokasi-sumber-air/,,https://www.youtube.com/watch?v=rmfc46JK4B8,,20211,WIROTAMAN,,AMPELGADING,KABUPATEN MALANG,JAWA TIMUR,-8.264338709391957,112.85639490182987," WIROTAMAN, KECAMATAN AMPELGADING, KABUPATEN MALANG, PROVINSI JAWA TIMUR"
173,KKN Mandiri Implementasi Konsep Industri Manufaktur untuk Perbaikan Produktivitas di Sentra Industri Makanan (Studi Kasus : IKM Keripik Tempe,2020-06-20,https://www.its.ac.id/news/2021/02/01/kenalkan-industri-manufaktur-tim-abmas-its-beri-pelatihan-ukm/,52bbe0c2698bc2195231c40ded1e989e,https://www.youtube.com/watch?v=zZ5tsFTKrrE&amp;feature=youtu.be,https://data.its.ac.id/file_server_its/kkn_download.php?object_id=52bbe0c2698bc2195231c40ded1e989e,20192,SANANKERTO,,TUREN,KABUPATEN MALANG,JAWA TIMUR,-8.1535976,112.7349428," SANANKERTO, KECAMATAN TUREN, KABUPATEN MALANG, PROVINSI JAWA TIMUR"
183,"KKN ABMAS PERANCANGAN ALAT PENYERUT DAN PENGEMAS PRODUK TUSUK SATE DENGAN DUAL SISTEM KENDALI (MIKROKONTROLER DAN MEKANISASI) (STUDI KASUS : IKM TUSUK SATE, DESA SANANKERTO, KECAMATAN TUREN, KABUPATEN MALANG)",2020-06-20,https://www.its.ac.id/news/2021/02/05/its-bantu-wujudkan-ukm-tusuk-sate-yang-mandiri/,69ccef49a76ba245fc5c4e9c8504434d,https://youtu.be/Z06bEDx3DsI,https://data.its.ac.id/file_server_its/kkn_download.php?object_id=69ccef49a76ba245fc5c4e9c8504434d,20192,SANANKERTO,,TUREN,KABUPATEN MALANG,JAWA TIMUR,-8.1535976,112.7349428," SANANKERTO, KECAMATAN TUREN, KABUPATEN MALANG, PROVINSI JAWA TIMUR"
447,"(Aplikasi Barcode Edukatif Sebagai Sistem Informasi Inventarisasi Tumbuhan di Kawasan Ekowisata Hutan Bambu: Strategi Pengelolaan Keanekaragaman Hayati Masyarakat Desa Sanankerto, Malang, Jawa Timur)",2022-06-01,https://www.its.ac.id/news/2022/09/16/kkn-abmas-its-bantu-kelola-keanekaragaman-bambu-berbasis-qr-code/,,https://youtu.be/ahCZNr4E1ec,,20212,SANANREJO,,TUREN,KABUPATEN MALANG,JAWA TIMUR,-8.1497398,112.7120343," SANANREJO, KECAMATAN TUREN, KABUPATEN MALANG, PROVINSI JAWA TIMUR"
337,KULIAH KERJA NYATA (KKN) PENDAMPINGAN SERTIFIKASI HALAL UMKM DI PROVINSI JAWA TIMUR,2021-06-30,https://www.its.ac.id/news/2021/11/18/tim-kkn-its-ajak-umkm-peduli-sertifikasi-halal/,b1f2804d67077d018a3eb17936de313d,https://www.youtube.com/watch?v=00EB0BE4gw8,https://data.its.ac.id/file_server_its/kkn_download.php?object_id=b1f2804d67077d018a3eb17936de313d,20202,GADING,,BULULAWANG,KABUPATEN MALANG,JAWA TIMUR,-8.101364056829976,112.63261612630215," GADING, KECAMATAN BULULAWANG, KABUPATEN MALANG, PROVINSI JAWA TIMUR"
444,KKN Leadership dan Mentoring Bisnis,2022-06-01,https://www.its.ac.id/news/en/2022/08/03/its-kkn-abmas-develops-entrepreneur-sociopreneur-module-in-malang/,,https://youtu.be/QyyYQWJ0toA,,20212,KETAWANG,,GONDANGLEGI,KABUPATEN MALANG,JAWA TIMUR,-8.1378634,112.6395409," KETAWANG, KECAMATAN GONDANGLEGI, KABUPATEN MALANG, PROVINSI JAWA TIMUR"
508,"Pemanfaatan Mesin Press Hidrolik untuk Meningkatkan Produktivitas Pemadatan Sampah Anorganik di UD Gunung Logam Desa Bedali, Kecamatan Lawang, Kabupaten Malang",2022-04-05,https://radarmalang.jawapos.com/malang-raya/kota-malang/29/10/2022/di-lawang- its-bikin-alat-pemadat-sampah-anorganik/,6a17e1660894b67b109020cb7d9f3c4c,https://youtu.be/ffHLUT308Jo,https://data.its.ac.id/file_server_its/kkn_download.php?object_id=6a17e1660894b67b109020cb7d9f3c4c,20212,BEDALI,Bedali,LAWANG,KABUPATEN MALANG,JAWA TIMUR,-7.8604182,112.6186264,"Bedali BEDALI, KECAMATAN LAWANG, KABUPATEN MALANG, PROVINSI JAWA TIMUR"
492,Kebijakan dan Implementasi IKM Naik Kelas ( Kewirausahaan DESA 4.0),2022-08-05,https://www.its.ac.id/news/2023/01/08/kkn-its-gagas-aplikasi-penilaian-performa-umkm/,11a86a47d4da69902f6c40f462a2268e,"BUMDESMa Singosari, Malang",https://data.its.ac.id/file_server_its/kkn_download.php?object_id=11a86a47d4da69902f6c40f462a2268e,20221,PAGENTAN,Pangetan,SINGOSARI,KABUPATEN MALANG,JAWA TIMUR,-7.7682744,112.0126117,"Pangetan PAGENTAN, KECAMATAN SINGOSARI, KABUPATEN MALANG, PROVINSI JAWA TIMUR"
154,KKN Abmas PENINGKATAN EKONOMI PONDOK PESANTREN AL-ISHLAHIYAH MELALUI PROSES MEMBRAN REVERSE-OSMOSIS UNTUK PRODUKSI AIR MINUM,2020-06-24,https://www.its.ac.id/news/2020/10/22/bantu-olah-air-bersih-its-aplikasikan-proses-reverse-osmosis-membrane/,584f3236f6c879c8e81f1d95c1ec75e8,https://www.youtube.com/watch?v=U7URW7KnOKo&amp;feature=youtu.be,https://data.its.ac.id/file_server_its/kkn_download.php?object_id=584f3236f6c879c8e81f1d95c1ec75e8,20192,PAGENTAN,,SINGOSARI,KABUPATEN MALANG,JAWA TIMUR,-7.8971954,112.6542183," PAGENTAN, KECAMATAN SINGOSARI, KABUPATEN MALANG, PROVINSI JAWA TIMUR"
366,PEMANFAATAN POTENSI ENERGI ALIRAN SUNGAI IRIGASI UNTUK PENERANGAN JALAN DENGAN MENGGUNAKAN TURBIN AIR CROSSFLOW,2021-04-05,https://radarmalang.jawapos.com/pendidikan/13/12/2021/dtmi-its-hasilkan-listrik-dari-aliran-irigasi-sawah-di-singosari/,6a34c87a039c7ff8e1c25280c1a55dcc,https://www.youtube.com/watch?v=KUq6WQrfDKo,https://data.its.ac.id/file_server_its/kkn_download.php?object_id=6a34c87a039c7ff8e1c25280c1a55dcc,20202,CANDIRENGGO,Candirenggo,SINGOSARI,KABUPATEN MALANG,JAWA TIMUR,-7.877825,112.6448218,"Candirenggo CANDIRENGGO, KECAMATAN SINGOSARI, KABUPATEN MALANG, PROVINSI JAWA TIMUR"
399,"PENINGKATAN POTENSI KAWASAN DENGAN PEMBUATAN PETA WISATA WADUK SELOREJO DESA PANDANSARI, KECAMATAN NGANTANG, KABUPATEN MALANG, PROVINSI JAWA TIMUR",2022-05-31,https://www.its.ac.id/news/2022/10/29/kkn-geomatika-its-ciptakan-peta-wisata-waduk-selorejo/,0102cd26eaf23446a9b8b1e6ddd7ffc8,https://www.youtube.com/watch?v=IR3-aAOWNCw,https://data.its.ac.id/file_server_its/kkn_download.php?object_id=0102cd26eaf23446a9b8b1e6ddd7ffc8,20212,PANDANSARI,Pandansari,NGANTANG,KABUPATEN MALANG,JAWA TIMUR,-7.8652762,112.3260915,"Pandansari PANDANSARI, KECAMATAN NGANTANG, KABUPATEN MALANG, PROVINSI JAWA TIMUR"
351,KKN KOLABORASI PTN JATIM PEDULI SEMERU,2021-12-20,https://www.its.ac.id/news/2021/12/20/tim-kkn-its-berkolaborasi-dengan-ptn-jatim-untuk-peduli-semeru/,e5092d344079c3de18bb20b911e6c7ce,https://www.youtube.com/watch?v=t2h9bwKwwkA,https://data.its.ac.id/file_server_its/kkn_download.php?object_id=e5092d344079c3de18bb20b911e6c7ce,20211,PENANGGAL,,CANDIPURO,KABUPATEN LUMAJANG,JAWA TIMUR,-8.140199959856698,113.0492727048463," PENANGGAL, KECAMATAN CANDIPURO, KABUPATEN LUMAJANG, PROVINSI JAWA TIMUR"
393,"Pemberdayaan Masyarakat Tangguh Bencana Erupsi Gunung Semeru Dan  Tsunami Berbasis Digital Di Desa Pasirian, Lumajang, Jawa Timur",2022-06-20,https://www.its.ac.id/news/2022/09/07/its-lakukan-mitigasi-bencana-di-desa-pengungsian-semeru/,,https://www.youtube.com/watch?v=IQ7jIW2aN4Y,,20212,PASIRIAN,Pasirian,PASIRIAN,KABUPATEN LUMAJANG,JAWA TIMUR,-8.2163049,113.0886934,"Pasirian PASIRIAN, KECAMATAN PASIRIAN, KABUPATEN LUMAJANG, PROVINSI JAWA TIMUR"
485,PENGEMBANGAN DESAIN KEMASAN DAN MARKETING PRODUK USAHA MIKROKECIL DAN MENENGAH  UNTUK PENINGKATAN PENJUALAN DAN PENDAPATAN USAHA DI KABUPATEN LUMAJANG,2022-07-01,https://www.its.ac.id/pdpm/id/2022/07/25/abmas-kkn- lumajang-membantu-peningkatan-usaha-umkm/,2730a040da217e8d28815b8b31d83cc1,https://youtu.be/-R-AtLGNLTQ,https://data.its.ac.id/file_server_its/kkn_download.php?object_id=2730a040da217e8d28815b8b31d83cc1,20221,TOMPOKERSAN,Tompokersan,LUMAJANG,KABUPATEN LUMAJANG,JAWA TIMUR,-8.122246227728533,113.22102549018155,"Tompokersan TOMPOKERSAN, KECAMATAN LUMAJANG, KABUPATEN LUMAJANG, PROVINSI JAWA TIMUR"
488,PENGEMBANGAN DESAIN KEMASAN DAN MARKETING PRODUK USAHA MIKROKECIL DAN MENENGAH UNTUK PENINGKATAN PENJUALAN DAN PENDAPATAN USAHA DI KABUPATEN LUMAJANG,2022-07-12,https://www.its.ac.id/pdpm/id/2022/07/25/abmas-kkn-lumajang-membantu-peningkatan-usaha-umkm/,8d70153ddd96fc4a00b0d817cf25a70e,https://youtu.be/-R-AtLGNLTQ,https://data.its.ac.id/file_server_its/kkn_download.php?object_id=8d70153ddd96fc4a00b0d817cf25a70e,20221,TOMPOKERSAN,Tompokersan,LUMAJANG,KABUPATEN LUMAJANG,JAWA TIMUR,-8.126601,113.2230854,"Tompokersan TOMPOKERSAN, KECAMATAN LUMAJANG, KABUPATEN LUMAJANG, PROVINSI JAWA TIMUR"
356,PEMBUATAN MESIN PENGGILING KOTORAN KAMBING UNTUK KELOMPOK TANI “KARYA BAKTI II” SEBAGAI UPAYA MENDUKUNG PROGRAM SIGARPUN – AKSI GERAKAN PEMUPUKAN ORGANIK DI KABUPATEN LUMAJANG,2021-06-01,https://www.its.ac.id/news/2022/03/22/mesin-inovasi-tim-kkn-its-mengakselerasi-pembuatan-pupuk-kandang/,a5a93a0fddee3c40f3068b0e90a2ce13,https://www.youtube.com/watch?v=6OnWdcUdPUA&amp;feature=youtu.be,https://data.its.ac.id/file_server_its/kkn_download.php?object_id=a5a93a0fddee3c40f3068b0e90a2ce13,20202,GUCIALIT,Kenongo,GUCIALIT,KABUPATEN LUMAJANG,JAWA TIMUR,-8.036432588211717,113.12421761964768,"Kenongo GUCIALIT, KECAMATAN GUCIALIT, KABUPATEN LUMAJANG, PROVINSI JAWA TIMUR"
54,KKNT RECON KEMDIKBUD: SOSIALISASI COVID-19 DARING,2020-08-17,https://nawacita.co/index.php/2020/10/19/kkn-t-07-lewat-daring-di-4-kabupaten-berikan-materi-covid-19-ke-pelajar/,4eb938704c127204a56d479f569f40fe,https://youtu.be/3AwMOxwGLHI,https://data.its.ac.id/file_server_its/kkn_download.php?object_id=4eb938704c127204a56d479f569f40fe,20201,WONOREJO,,KEDUNGJAJANG,KABUPATEN LUMAJANG,JAWA TIMUR,-8.0777381,113.2272749," WONOREJO, KECAMATAN KEDUNGJAJANG, KABUPATEN LUMAJANG, PROVINSI JAWA TIMUR"
539,Pemberdayaan Wanita melalui Peningkatan Kualitas Produk  UKM:Meningkatkan Kepercayaan dan Daya Saing Produk  UKM dengan Perolehan Izin edar dan Sertifikasi Halal,2022-05-01,https://www.its.ac.id/news/2022/08/25/abmas-its-gencarkan-umkm-melakukan-sertifikasi-halal-self-declare/,f7825c28a0ea1c44a1601f24cdd78f7d,https://youtu.be/-wEnAHiZhNg,https://data.its.ac.id/file_server_its/kkn_download.php?object_id=f7825c28a0ea1c44a1601f24cdd78f7d,20212,PESANGGARAN,"pesanggaran rt 001,rw 001",PESANGGARAN,KABUPATEN BANYUWANGI,JAWA TIMUR,-8.5265685,113.9785655,"pesanggaran rt 001,rw 001 PESANGGARAN, KECAMATAN PESANGGARAN, KABUPATEN BANYUWANGI, PROVINSI JAWA TIMUR"
136,PELATIHAN FINANSIAL LITERASI BUMDES KALIPAIT,2020-08-09,https://www.its.ac.id/kemahasiswaan/id/bumi-iboe-dan-kontribusinya-untuk-desa-kalipait-banyuwangi/,67dd5aea2d74c65312de76ce19df35aa,https://www.youtube.com/watch?v=znQQ9EaoV_Y&amp;feature=youtu.be,https://data.its.ac.id/file_server_its/kkn_download.php?object_id=67dd5aea2d74c65312de76ce19df35aa,20201,TEGALDLIMO,,TEGALDLIMO,KABUPATEN BANYUWANGI,JAWA TIMUR,-8.6134916,114.2963362," TEGALDLIMO, KECAMATAN TEGALDLIMO, KABUPATEN BANYUWANGI, PROVINSI JAWA TIMUR"
179,"KKN PEMBUATAN ALAT PENGERING KERUPUK OTOMATIS HEMAT BIAYA SEBAGAI UPAYA MENINGKATKAN HASIL PRODUKSI KERUPUK CUMI DI DESA WRINGIN PUTIH, MUNCAR BANYUWANGI",2020-10-01,https://edukasi.sindonews.com/read/293724/211/bantu-umkm-tim-kkn-its-inovasikan-alat-pengering-kerupuk-otomatis-1610031717,8580f1189f2f8e014f10bbf91f0478e4,https://www.youtube.com/watch?v=pojHwgAL7SA&amp;t=104s,https://data.its.ac.id/file_server_its/kkn_download.php?object_id=8580f1189f2f8e014f10bbf91f0478e4,20201,WRINGIN PUTIH,,MUNCAR,KABUPATEN BANYUWANGI,JAWA TIMUR,-8.4866398,114.3143937," WRINGIN PUTIH, KECAMATAN MUNCAR, KABUPATEN BANYUWANGI, PROVINSI JAWA TIMUR"
286,Pengembangan Aplikasi Akuntansi Sederhana untuk UMKM berbasis Android,2021-08-07,https://www.its.ac.id/news/2021/11/27/kiosku-aplikasi-ciptaan-tim-kkn-abmas-its-untuk-umkm/,44bf3e6b8799026729c34e2631cad0bf,https://www.youtube.com/watch?v=vjFqPrPmfD0,https://data.its.ac.id/file_server_its/kkn_download.php?object_id=44bf3e6b8799026729c34e2631cad0bf,20211,WRINGIN PUTIH,,MUNCAR,KABUPATEN BANYUWANGI,JAWA TIMUR,-8.366001992771318,114.34326049811858," WRINGIN PUTIH, KECAMATAN MUNCAR, KABUPATEN BANYUWANGI, PROVINSI JAWA TIMUR"
284,Pembuatan Konten Pembelajaran Digital Interaktif untuk Materi Pembelajaran Bahasa Arab (Nahwu dan Shorof) untuk Santri Milenial di Pondok Pesantren,2021-08-06,https://www.its.ac.id/news/2021/11/27/its-inovasikan-media-pembelajaran-digital-pondok-pesantren/,c107640a51c04f49001e60020404468c,https://www.youtube.com/watch?v=zUWpQ-W84YI,https://data.its.ac.id/file_server_its/kkn_download.php?object_id=c107640a51c04f49001e60020404468c,20211,WRINGIN PUTIH,,MUNCAR,KABUPATEN BANYUWANGI,JAWA TIMUR,-8.480468317631603,114.3346329355822," WRINGIN PUTIH, KECAMATAN MUNCAR, KABUPATEN BANYUWANGI, PROVINSI JAWA TIMUR"
115,Relawan Covid 19 Kemdikbud PENCEGAHAN DAN PENANGGULANGAN COVID-19 TERHADAP MASYARAKAT TAMANAGUNG MELALUI PERANTARA PEMBATASAN JARAK PADA TEMPAT DUDUK DI MASA PANDEMI DESA TAMANAGUNG KECAMATAN CLURING KABUPATEN BANYUWANGI,2020-08-17,https://www.its.ac.id/news/2020/10/10/melalui-kkn-mahasiswa-its-bantu-tegakkan-protokol-kesehatan/,4e9fcfcdf87947c849a871a5971efd5d,https://www.youtube.com/watch?v=Qonmp9-DBNM,https://data.its.ac.id/file_server_its/kkn_download.php?object_id=4e9fcfcdf87947c849a871a5971efd5d,20201,TAMANAGUNG,,CLURING,KABUPATEN BANYUWANGI,JAWA TIMUR,-8.4064784,114.1751103," TAMANAGUNG, KECAMATAN CLURING, KABUPATEN BANYUWANGI, PROVINSI JAWA TIMUR"
221,"KKN Mandiri PELATIHAN TEKNOLOGI ONLINE LEARNING UNTUK PARA GURU DI LINGKUNGAN PONDOK PESANTREN DARUSSALAM, BLOKAGUNG, BANYUWANGI",2020-07-30,https://www.its.ac.id/news/2021/03/08/kkn-its-latih-pengajar-pesantren-hadapi-kuliah-online/,9737f2ff2274bc85ff0fa6c11d85a8b4,https://www.youtube.com/watch?v=OU1c1qfa2Rs,https://data.its.ac.id/file_server_its/kkn_download.php?object_id=9737f2ff2274bc85ff0fa6c11d85a8b4,20201,KARANGDORO,,TEGALSARI,KABUPATEN BANYUWANGI,JAWA TIMUR,-8.4208561,114.0929354," KARANGDORO, KECAMATAN TEGALSARI, KABUPATEN BANYUWANGI, PROVINSI JAWA TIMUR"
114,"Relawan Covid 19 Kemdikbud PENYULUHAN DAN OPTIMALISASI RUANG PUBLIK SEBAGAI SARANA PENCEGAHAN PENYAKIT COVID-19 KELURAHAN BULUSAN KECAMATAN KALIPURO , KABUPATEN BANYUWANGI",2020-08-17,https://www.its.ac.id/news/2020/10/10/melalui-kkn-mahasiswa-its-bantu-tegakkan-protokol-kesehatan/,12ba22eec69a3f24b2b5307f9b2c3aff,https://www.youtube.com/watch?v=Qonmp9-DBNM,https://data.its.ac.id/file_server_its/kkn_download.php?object_id=12ba22eec69a3f24b2b5307f9b2c3aff,20201,BULUSAN,,KALIPURO,KABUPATEN BANYUWANGI,JAWA TIMUR,-8.12848,114.3443383," BULUSAN, KECAMATAN KALIPURO, KABUPATEN BANYUWANGI, PROVINSI JAWA TIMUR"
53,"KKNT RECON KEMDIKBUD: KKN TEMATIK LITERASI DAN NUMERASI DESA SUMBERKEDAWUNG KECAMATAN LECES, KABUPATEN PROBOLINGGO",2020-08-17,https://radarbromo.jawapos.com/daerah/17/10/2020/tim-kknt-covid-19-its02-ambil-peran-efektifkan-belajar-siswa/,5b0dd139460bc7336a659368e787084a,https://youtu.be/oSKAktMQtak,https://data.its.ac.id/file_server_its/kkn_download.php?object_id=5b0dd139460bc7336a659368e787084a,20201,SUMBERKEDAWUNG,,LECES,KABUPATEN PROBOLINGGO,JAWA TIMUR,-7.8453936,113.2154112," SUMBERKEDAWUNG, KECAMATAN LECES, KABUPATEN PROBOLINGGO, PROVINSI JAWA TIMUR"
